{
  "schema_version": 1,
  "kind": "tastecheck-release-check-catalog",
  "catalog_id": "tastecheck-pass-v1",
  "checks": [
    { "id": "direction:system", "label": "Committed design system or inferred system", "stage": "direction", "required": true, "applicability": { "kind": "always" }, "na_policy": "forbidden", "manual_inspector_required": false, "judgment": "subjective", "observation": { "coverage": "single", "type": "boolean_bundle", "fields": ["spec_present", "built_to_spec"] } },
    { "id": "foundation:color", "label": "Color roles and contrast foundations", "stage": "foundations", "required": true, "applicability": { "kind": "always" }, "na_policy": "forbidden", "manual_inspector_required": false, "judgment": "deterministic", "observation": { "coverage": "single", "type": "contrast", "fields": ["pairs"] } },
    { "id": "foundation:typography", "label": "Typography and reading constraints", "stage": "foundations", "required": true, "applicability": { "kind": "always" }, "na_policy": "forbidden", "manual_inspector_required": false, "judgment": "deterministic", "observation": { "coverage": "single", "type": "boolean_bundle", "fields": ["font_loads", "measure_holds", "wraps_without_overflow"] } },
    { "id": "foundation:spacing", "label": "Spacing and density system", "stage": "foundations", "required": true, "applicability": { "kind": "always" }, "na_policy": "forbidden", "manual_inspector_required": false, "judgment": "deterministic", "observation": { "coverage": "single", "type": "boolean_bundle", "fields": ["scale_present", "off_scale_decisions", "proximity_verified"] } },
    { "id": "foundation:theming", "label": "Theme role mappings", "stage": "foundations", "required": true, "applicability": { "kind": "always" }, "na_policy": "forbidden", "manual_inspector_required": false, "judgment": "deterministic", "observation": { "coverage": "single", "type": "boolean_bundle", "fields": ["theme_roles_mapped", "theme_states_measured"] } },
    { "id": "structure:responsive-layout", "label": "Responsive layout", "stage": "structure", "required": true, "applicability": { "kind": "always" }, "na_policy": "forbidden", "manual_inspector_required": false, "judgment": "deterministic", "observation": { "coverage": "browser", "type": "boolean_bundle", "fields": ["rendered", "overflow_free", "hierarchy_preserved"] } },
    { "id": "structure:component-states", "label": "Component lifecycle states", "stage": "structure", "required": true, "applicability": { "kind": "always" }, "na_policy": "forbidden", "manual_inspector_required": false, "judgment": "deterministic", "observation": { "coverage": "control-state", "type": "boolean_bundle", "fields": ["state_present", "keyboard_reachable", "focus_visible"] } },
    { "id": "structure:form-ux", "label": "Form behavior and recovery", "stage": "structure", "required": true, "applicability": { "kind": "always" }, "na_policy": "forbidden", "manual_inspector_required": false, "judgment": "deterministic", "observation": { "coverage": "control-state", "type": "boolean_bundle", "fields": ["labels_and_autocomplete", "validation_recoverable", "submission_recoverable"] } },
    { "id": "structure:empty-states", "label": "Empty, loading, permission, and error states", "stage": "structure", "required": true, "applicability": { "kind": "always" }, "na_policy": "forbidden", "manual_inspector_required": false, "judgment": "deterministic", "observation": { "coverage": "control-state", "type": "boolean_bundle", "fields": ["state_present", "recovery_available", "layout_stable"] } },
    { "id": "surface:micro-motion", "label": "Purposeful motion and interruption policy", "stage": "surface", "required": false, "applicability": { "kind": "optional_subject", "subject": "motion" }, "na_policy": "subject_absence", "manual_inspector_required": false, "judgment": "subjective", "observation": { "coverage": "single", "type": "boolean_bundle", "fields": ["purposeful_motion", "reduced_motion_safe"] } },
    { "id": "surface:data-viz", "label": "Data visualization and uncertainty treatment", "stage": "surface", "required": false, "applicability": { "kind": "optional_subject", "subject": "data-viz" }, "na_policy": "subject_absence", "manual_inspector_required": false, "judgment": "subjective", "observation": { "coverage": "single", "type": "boolean_bundle", "fields": ["uncertainty_shown", "direct_labels", "accessible_table"] } },
    { "id": "surface:art-direction", "label": "Imagery, illustration, and iconography system", "stage": "surface", "required": false, "applicability": { "kind": "optional_subject", "subject": "art-direction" }, "na_policy": "subject_absence", "manual_inspector_required": false, "judgment": "subjective", "observation": { "coverage": "single", "type": "boolean_bundle", "fields": ["asset_roles_defined", "alt_or_decorative_marked"] } },
    { "id": "verification:a11y", "label": "Accessibility audit", "stage": "verification", "required": true, "applicability": { "kind": "always" }, "na_policy": "forbidden", "manual_inspector_required": false, "judgment": "deterministic", "observation": { "coverage": "single", "type": "boolean_bundle", "fields": ["violations_resolved", "keyboard_reachable", "contrast_measured"] } },
    { "id": "verification:cognitive-a11y", "label": "Cognitive accessibility friction", "stage": "verification", "required": false, "applicability": { "kind": "optional_subject", "subject": "cognitive-friction" }, "na_policy": "subject_absence", "manual_inspector_required": false, "judgment": "subjective", "observation": { "coverage": "single", "type": "boolean_bundle", "fields": ["friction_reviewed", "predictable_recovery"] } },
    { "id": "verification:i18n", "label": "Locale and bidirectional resilience", "stage": "verification", "required": false, "applicability": { "kind": "optional_subject", "subject": "multilingual" }, "na_policy": "subject_absence", "manual_inspector_required": false, "judgment": "subjective", "observation": { "coverage": "single", "type": "boolean_bundle", "fields": ["locale_expansion_tested", "bidi_safe"] } },
    { "id": "verification:deslop-ui", "label": "Against-spec deslop audit", "stage": "verification", "required": true, "applicability": { "kind": "always" }, "na_policy": "forbidden", "manual_inspector_required": false, "judgment": "subjective", "observation": { "coverage": "single", "type": "boolean_bundle", "fields": ["against_spec", "tells_reviewed"] } },
    { "id": "verification:humanize-copy", "label": "Humanize-copy audit", "stage": "verification", "required": true, "applicability": { "kind": "always" }, "na_policy": "forbidden", "manual_inspector_required": false, "judgment": "subjective", "observation": { "coverage": "single", "type": "boolean_bundle", "fields": ["source_bound_copy", "generic_tells_resolved"] } },
    { "id": "browser:rendering", "label": "Browser rendering at required widths", "stage": "browser", "required": true, "applicability": { "kind": "always" }, "na_policy": "forbidden", "manual_inspector_required": true, "judgment": "subjective", "observation": { "coverage": "browser", "type": "boolean_bundle", "fields": ["rendered", "overflow_free", "expected_layout"] } },
    { "id": "browser:zoom-400", "label": "400 percent zoom", "stage": "browser", "required": true, "applicability": { "kind": "always" }, "na_policy": "forbidden", "manual_inspector_required": true, "judgment": "subjective", "observation": { "coverage": "browser", "type": "boolean_bundle", "fields": ["zoom_400_tested", "reflow_without_loss"] } },
    { "id": "browser:keyboard", "label": "Keyboard and focus path", "stage": "browser", "required": true, "applicability": { "kind": "always" }, "na_policy": "forbidden", "manual_inspector_required": true, "judgment": "subjective", "observation": { "coverage": "browser", "type": "boolean_bundle", "fields": ["focus_path_complete", "focus_visible", "activation_parity"] } },
    { "id": "browser:theme-contrast", "label": "Theme contrast measurements", "stage": "browser", "required": true, "applicability": { "kind": "always" }, "na_policy": "forbidden", "manual_inspector_required": true, "judgment": "deterministic", "observation": { "coverage": "browser", "type": "contrast", "fields": ["pairs"] } },
    { "id": "browser:reduced-motion", "label": "Reduced-motion behavior", "stage": "browser", "required": true, "applicability": { "kind": "always" }, "na_policy": "forbidden", "manual_inspector_required": true, "judgment": "deterministic", "observation": { "coverage": "browser", "type": "boolean_bundle", "fields": ["reduced_motion_setting", "motion_suppressed"] } },
    { "id": "browser:cold-load", "label": "Cold-load audit", "stage": "browser", "required": true, "applicability": { "kind": "always" }, "na_policy": "forbidden", "manual_inspector_required": true, "judgment": "subjective", "observation": { "coverage": "browser", "type": "boolean_bundle", "fields": ["initial_render", "console_clean", "no_hidden_loading"] } },
    { "id": "browser:shadow-iframe", "label": "Shadow-root and iframe coverage", "stage": "browser", "required": false, "applicability": { "kind": "optional_subject", "subject": "shadow-or-iframe" }, "na_policy": "subject_absence", "manual_inspector_required": true, "judgment": "subjective", "observation": { "coverage": "browser", "type": "boolean_bundle", "fields": ["roots_inspected", "coverage_complete"] } },
    { "id": "gate:artifact-spec", "label": "Real artifact and spec identity", "stage": "gate", "required": true, "applicability": { "kind": "always" }, "na_policy": "forbidden", "manual_inspector_required": false, "judgment": "deterministic", "observation": { "coverage": "single", "type": "boolean_bundle", "fields": ["artifact_hash_verified", "dependency_manifest_verified", "spec_identity_bound"] } },